text,event,severity,outlet,url,bias
"The Trump administration has claimed the Venezuelan gang Tren de Aragua had taken over the building. But new documents make no mention of the gang and reveal federal agents had information about “illegal aliens unlawfully occupying apartments.” For months, the Trump administration has justified its dramatic midnight raid on a Chicago apartment complex by saying that it had intelligence that the violent Venezuelan gang Tren de Aragua had taken over the building. But officials have provided no evidence to back up the claim. Now, new documents confirm in the government’s own words that what prompted the raid was more pedestrian: allegations that immigrants were squatting in the complex. And the landlord had given federal officials, who were already targeting immigrants in Chicago, the blessing to search the building. Arrest records for two of the 37 immigrants detained that September night, included in a motion filed Tuesday that’s tied to an ongoing federal consent decree, provide the clearest picture yet of what led to the controversial and aggressive operation, in which agents descended from a Blackhawk helicopter, broke down doors and zip-tied U.S. citizens and immigrants. The records reveal that agents entered and searched the complex with the “owner/manager’s verbal and written consent.” Agents wrote that they launched the operation “based on intelligence that there were illegal aliens unlawfully occupying apartments.” They said they focused their search on units “that were not legally rented or leased at the time.” That narrative appears word for word in both arrest reports — for a Venezuelan man and a Mexican man. “It was a brutal lie against the American public,” said Mark Fleming, an attorney with the National Immigrant Justice Center and co-counsel in a lawsuit against the government that led to the consent decree. “This was really about immigrants purportedly occupying apartments unlawfully, which is radically different than the story they told.” The U.S. Department of Homeland Security makes no mention in the records of Tren de Aragua, even though officials repeatedly cited the gang’s presence in the building as the motivation for the raid. Agents paraded immigrants in front of cameras and called their arrests a victory against terrorism. The government also claimed two of those arrested were gang members but never provided any proof. The new documents obtained by ProPublica show that the motive for the federal raid was allegations that immigrants were squatting in the complex. Obtained by ProPublica ProPublica previously reported, based on interviews and records, that there was little evidence to back up the government’s claims. Even today, four months after the raid, federal prosecutors have not filed criminal charges against anyone who was arrested. Over the past few months, ProPublica has interviewed 15 of the immigrants detained that night; all denied gang membership. They and others who lived in the building acknowledged there was criminal activity there, including the murder of a Venezuelan man last summer, but nobody knew of gang members there. The two arrest records were filed in federal court as part of ongoing litigation over whether the government, during its monthslong deportation campaign in Chicago, violated a 2022 consent decree that limits warrantless arrests. The consent decree is still in place, and the government continues to challenge it. Government attorneys had previously acknowledged in court that hundreds of immigrants detained last year may have been improperly arrested. Following a court order, DHS has been providing administrative arrest records to attorneys who now are demanding the release of some of those immigrants from custody or the removal of restrictions for those who are already out. That includes the Venezuelan man and Mexican man taken during the raid. In the motion filed Tuesday night, immigrant rights attorneys said that to justify warrantless arrests across Chicago, the government described immigrants as flight risks though they were not. Some of the factors that DHS used to make that determination for the South Shore men — including their “willful disregard for other’s personal property” and their “attempt to flee from law enforcement” — were baseless and contradicted by the arrest narratives, the attorneys wrote. Even more of the 37 arrests that night may have violated the consent decree, attorneys said, but the cases under review are for those who remain in the U.S. As the weeks and months passed, most of the immigrants detained in the South Shore raid were deported or gave up on their efforts to stay in the country. The property owner, Trinity Flood, a Wisconsin-based real estate investor, and the management company at the time of the raid, Strength in Management, did not immediately respond to requests for comment on Wednesday morning. Flood and Corey Oliver, the management company’s owner, have repeatedly declined interview requests and have not acknowledged any involvement in the operation. A DHS spokesperson did not respond to questions Wednesday morning but repeated earlier statements that the raid was performed legally. “Given that two individuals of a Foreign Terrorist Organization were arrested, at a building they are known to frequent, we are limited on further information we can provide,” the spokesperson said. From the beginning there had been questions about whether Flood and her property manager tipped off the government to get rid of squatters in her building, which had repeatedly failed city inspections in the two years before the raid. Last month, state officials launched a housing discrimination investigation into allegations that Flood and Strength in Management used federal agents to illegally force the Black and Hispanic tenants from the 130-unit building in Chicago’s South Shore neighborhood. In their complaint, state officials wrote that “building management blamed Venezuelan tenants for their own (management’s) failure to provide needed locks and security service, as well as other needed maintenance and repairs, and perpetuated stereotypes about Venezuelan gang members to send a message that tenants born outside of the United States were considered gang associates, even if they were law abiding.” Within hours of the raid, workers from the management company were tossing tenants’ belongings in the trash and clearing out apartments, the complaint states. State officials said that they could not provide any additional information on an ongoing investigation, but that they look forward to a response from Flood and Strength in Management. Several Venezuelan immigrants detained that night said they were angry to learn that the building’s owner and property manager had facilitated federal agents’ entry. “We were paying our rent, doing things the right way,” said Jean Carlos Antonio Colmenares Pérez, 39. “Then suddenly, boom, the government comes in and takes us out. I don’t understand.” Colmenares spent more than two months in federal custody before he was deported in December. “They took us out as if we were dogs. As if we were criminals,” said his cousin, Daniel José Henríquez Rojas, 43. Henríquez was detained for about two months before he was deported. Federal agents also took his wife and then-6-year-son that night and later transported them to a facility in Texas where they were detained for about a month. The family is now back together in Venezuela. Johandry José Andrade Jiménez, 23, had moved into the South Shore complex with his wife and three young daughters just two days before the raid. Andrade was deported in December. His wife was released with an ankle monitor in Chicago, where she now struggles to support their daughters alone. “They separated me from my family,” Andrade said. “I feel awful.” “I Lost Everything”: Venezuelans Were Rounded Up in a Dramatic Midnight Raid but Never Charged With a Crime The complex was home to dozens of mostly African American and Venezuelan tenants. While some said they had stopped paying rent because of the dangerous and dilapidated conditions, close to a dozen Venezuelans, including Colmenares, Henríquez and Andrade, told us they were paying rent to people they believed worked for the management company. But in some cases, that money was going to other tenants who claimed to be the managers. ProPublica interviewed a U.S. citizen who said that he and others moved Venezuelan families into empty units, charged whatever amount they believed was fair and pocketed the money.“We started making them pay rent to us,” the man said. Flood, who is facing a foreclosure lawsuit, said in court records last fall that her company had invested millions of dollars to repair and maintain the building and on legal fees for evictions. Weeks before the raid, the company obtained court orders to evict squatters. The building continued to deteriorate after the raid. Oliver testified in court that he briefly hired security people but then fired them after they didn’t do their jobs. In November, a county judge ordered that another company take over management of the building and required that the remaining residents move out.","Tren de Aragua, in Chicago",brandishing,ProPublica,https://www.propublica.org/article/chicago-venezuela-immigration-ice-raid-landlord-tren-de-aragua,left-leaning
"The Brief: Federal agents raided a South Shore apartment building early Tuesday, arresting at least 37 undocumented immigrants, some suspected of ties to the Tren de Aragua gang. DHS and FBI officials said the operation targeted drug trafficking, weapons crimes, and immigration violations, though local police were not involved. Activists and a state senator condemned the raid, calling it harmful to immigrant families and the community. CHICAGO - Federal agents carried out an immigration raid early Tuesday on Chicago’s South Side, taking at least 37 undocumented immigrants into custody in an area known to be frequented by Tren de Aragua gang members. What we know: The Department of Homeland Security said Wednesday that ""some of the targeted subjects are believed to be involved in drug trafficking and distribution, weapons crimes, and immigration violators."" The FBI confirmed in a statement to FOX 32 Chicago that their agency assisted U.S. Border Patrol in conducting a ""targeted immigration enforcement operation."" Video from overnight showed dozens of federal agents from Border Patrol, FBI and ATF gathered outside an apartment building in the 7500 block of S. South Shore Drive, in the South Shore neighborhood. No Chicago police officers took part in the operation. Federal agents carried out an immigration raid early Tuesday on Chicago’s South Side, taking at least 37 undocumented immigrants into custody in an area known to be frequented by Tren de Aragua gang members. Neighbors said they were awakened by loud noises in the middle of the night and saw federal agents dressed in military-style uniforms had surrounded the building. ""Honestly, I have a lot of mixed emotions about this. You know, I've just moved over here about a year ago, and just seeing it happen in person, it's kind of sad. You hear people screaming, you hear loud bangs and pops,"" he said. A Border Patrol official told FOX News they were seeking six high-priority targets, including suspected members of Tren de Aragua, a Venezuelan criminal organization. The official said the building had been overtaken by criminal undocumented immigrants. Feds seek deployment of 100 troops to Illinois to protect ICE agents, Pritzker says Gov. Pritzker said the Trump administration is seeking to deploy 100 military troops to Illinois to protect ICE agents and facilities. The reports come a day after Gov. JB Pritzker announced that the Department of Homeland Security wants to deploy troops to protect immigration enforcement operations in Chicago. He said the Illinois National Guard had been alerted to the request. ‘Absolutely disgusting’ Local perspective: On Tuesday afternoon, local activists and a state lawmaker denounced the raid, especially in a community that has been historically welcoming to others. Veronica Castro, of the Illinois Coalition for Immigrant & Refugee Rights, said activists were speaking to neighbors after the raid. The neighbors said they saw at least two dozen people, including children, being arrested. ""It’s not right,"" Castro said. ""Folks were just trying to live their lives in this community."" State Sen. Robert Peters (D-Chicago) said what happened overnight was ""absolutely disgusting"" and blasted the Trump administration for the immigration arrests which he argued do ""nothing to make us safer.""","Tren de Aragua, in Chicago",brandishing,FOX,https://www.fox32chicago.com/news/immigration-raids-chicago-south-side,right-leaning
"We have to be good or ICE will get us': Takeaways from Chicago children caught in immigration raids Just before noon on a sunny Friday earlier this month, federal immigration agents threw tear gas canisters onto a busy Chicago street, just outside of an elementary school and a children's play cafe. Parents, teachers and caretakers rushed to shield children from the chaos, and have been grappling ever since with how to explain to them what they'd seen: how much to tell them so they know enough to stay safe, but not too much to rob them of their innocence. Weeks later, families — even those not likely in danger of being rounded up in immigration raids — say they remain terrified it will happen again, demonstrating how fear seeps into every facet of American life when the Trump administration's immigration crackdown takes over a city. Why did the agents tear gas a residential neighborhood? The Department of Homeland Security said in a statement that Border Patrol agents were 'impeded by protesters' during a targeted enforcement operation in which one man was arrested. The Chicago crackdown, dubbed 'Operation Midway Blitz,' began in early September. Masked, armed agents in unmarked trucks patrol neighborhoods, and residents have protested in ways big and small against what they see as their city under siege. DHS wrote that its agents are being terrorized: 'Our brave officers are facing a surge in increase in assaults against them, inducing sniper attacks, cars being used as weapons on them, and assaults by rioters. This violence against law enforcement must END. We will not be deterred by rioters and protesters in keeping America safe.' The agents arrived in an unmarked SUV about half a block from Funston Elementary School in Logan Square, a neighborhood on the city's northwest side. Videos show they were being tailed by cars that were honking their horns to alert neighbors that this was an immigration enforcement operation. A scooter pulled in front of the SUV to try to block it in. The SUV's passenger side window rolled down and a masked man inside threw the tear gas canisters onto the street. The DHS statement said agents deployed tear gas and pepper balls 'after repeated vocal attempts to disperse the crowd.' Witnesses say there was no warning Fifth grade teacher Liza Oliva-Perez was walking to the grocery store across the street for lunch. She noticed a helicopter circling, then the SUV and its tail of honking cars. That morning, another teacher gave her a whistle with instructions to blow it if immigration agents were nearby. As Oliva-Perez fumbled getting the whistle to her lips, the SUV's window rolled down and the masked man threw the first gas canister. 'I couldn't fathom that was happening,' said Oliva-Perez. Then he threw another, this time in her direction. She said she was only feet away on the sidewalk and didn't hear the agents say anything. Then she ran toward the school, yelling at staff to get the children inside. Toddlers were having lunch at a play cafe down the street A half-dozen toddlers were sitting in the window of the Luna y Cielo Play Cafe, where children learn Spanish as they play while parents and caregivers sip coffee. Owner Vanessa Aguirre-Ávalos ran outside to see what was happening, as the children's nannies hustled them to a back room. Aguirre-Ávalos is a U.S. citizen and the nannies are citizens or are legally allowed to work in the U.S. Even so, they were terrified. One nanny begged Aguirre-Avalos: If they take me, please make sure the children get home safe. Molly Kucich, whose 2-year-old and 14-month old sons were at Luna y Cielo, was grocery shopping. Her husband called. She heard 'immigration raid' and then: 'tear gas.' She abandoned her grocery cart and drove as fast as she could and pulled up onto the curb outside, so frantic to get to her boys that she didn't care if her car might be towed. The 2-year-old was so frightened that he stuttered. 'Mommy, mommy, mommy,' he repeated, clinging to her. In the weeks since, he's fixated on his nanny, a U.S. citizen from Guatemala. He asks where she is and when she's coming. He jumps at the sound of sirens. His mother called their pediatrician for a referral to see a therapist. Since the incident, Andrea Soria, whose 6-year-old plays at Luna y Cielo, has overheard her whisper to her dolls: 'We have to be good or ICE will get us,' referring to U.S. Immigration and Customs Enforcement. 'These kids are traumatized,' Aguirre-Ávalos said. 'Even if ICE stops doing what they're doing right now, people are going to be traumatized. The damage is already done.' The neighborhood rushes to protect its children Teachers at Funston Elementary spent the afternoon telling the children that everything was fine. But they dreaded the bell at the end of the day. They'd have to lead the students outside, and they didn't know what would be waiting. Masked men? More tear gas? First grade teacher Maria Heavener spread the word in community group chats that the school needed help. When the final bell rang, she walked her students outside. In every direction, neighbors lined the sidewalk, dozens of them. There were people who'd never considered themselves activists, or even particularly political, standing there, enraged, scanning the streets for unmarked SUVs and masked men. They signed up to come back every morning and afternoon. 'You don't mess with the kids. You don't go near the schools,' Heavener said. 'Whatever your agenda is, that feels like it's crossing a lot of lines.' Evelyn Medina stood outside her gift shop next door to the school and watched the children walking by. Two little boys gripped each other so tightly their fingers dug into each other's hands. 'They were so scared,' said Medina, who cries when she thinks about how they looked leaving school that day. 'It was really hard to see, imagining what's going on in their little minds.'","Logan Square, chicago",lesslethal,CBS,https://www.cbsnews.com/chicago/news/chicago-children-immigration-raids/,left-leaning
"Mayor Brandon Johnson and school officials are responding after a teacher reported seeing ICE agents deploy chemical irritants outside a Chicago elementary school. The Brief: A teacher at Funston Elementary in Logan Square said she saw ICE agents outside the school Friday and claimed one threw tear gas canisters after a confrontation. Mayor Brandon Johnson condemned the incident, praising community ""rapid responders"" and local organizing efforts. Students were kept indoors for safety, and volunteers surrounded the school at dismissal to watch for any return of ICE agents. CHICAGO - Mayor Brandon Johnson and school officials are responding after a teacher reported seeing ICE agents deploy chemical irritants outside a Chicago elementary school. What we know: The teacher, a member of the Chicago Teachers Union, said the incident happened Friday as she stepped out for lunch at Funston Elementary School on Armitage Avenue in the Logan Square neighborhood. She said she noticed a white vehicle ""full of ICE agents"" and blew her whistle to alert others.  Moments later, a person on a scooter approached the agents and nearby cars began honking. The teacher said one agent became frustrated and began throwing tear gas canisters toward the crowd. ""Nobody wants ICE here. Just regular people are figuring out how to be there for one another… there's an outpouring of people who understand the assignment,"" she said.  ""We are not in this position of strength if it were not for our rapid responders… I have a great deal of gratitude for the organizing that is happening on the ground,"" Johnson said. What's next: Some students were ushered inside, and recess was held indoors for the rest of the day. At dismissal, rapid response team volunteers and neighborhood residents surrounded the school — some wearing bicycle helmets, gas masks and red whistles — prepared to alert families if ICE agents returned.","Logan Square, chicago",lesslethal,FOX,https://www.fox32chicago.com/news/teacher-claims-ice-agents-used-tear-gas-near-chicago-elementary-school,right-leaning
