text,event,severity,outlet,url,bias
"Federal immigration officers were injured in St. Paul, Minnesota, after a Cuban illegal alien rammed ICE vehicles and struck agents during a violent encounter Sunday.

ICE officers identified Juan Carlos Rodrigues Romero, an illegal alien from Cuba, as he entered a white SUV near Westminster Street in St. Paul, Minnesota, then conducted a lawful traffic stop on Dec. 21.

When officers ordered Romero to roll down his window, he allegedly refused, prompting warnings they would break it if he continued to disobey lawful commands.

Instead, Romero drove off and allegedly struck one of the officers while attempting to flee.

ICE officers pursued Romero until he pulled into a parking lot near his residence, striking two parked vehicles.

Officers again stopped Romero and ordered him out of the vehicle, but he allegedly rammed an ICE unit and struck another officer.

The officer who was struck defensively fired two rounds from his service weapon at Romero’s vehicle, ICE said, but no one was hit and Romero drove off.

Romero then drove to the front entrance of his apartment complex, rammed another ICE vehicle and attempted to flee on foot toward his apartment.

Officers chased Romero down and brought him to the ground, where he violently resisted arrest and bit one of the officers, ICE said.

Romero was eventually subdued and placed in handcuffs.

Two officers sustained non-life-threatening injuries and were taken to a hospital for evaluation.

Romero, who remains in ICE custody, was also transported to a hospital for evaluation.

ICE said Romero was admitted into the U.S. in 2024 under the Biden administration’s CBP One app.

In April, migrants who entered the U.S. under CBP One had their protections terminated and were ordered to leave the U.S. immediately or face a permanent ban from reentering the U.S.

The app was used by nearly 1 million migrants to schedule appointments at official ports of entry before they were paroled into the U.S. The migrants were permitted to seek asylum and given temporary work authorization for two years while they waited for the outcomes of their respective proceedings. 

Trump ended the use of the CBP One app to parole migrants on his first day in office. His administration has also paused applications for parole programs and allowed ICE to cancel parole statuses of migrants.

The CBP One app launched in January 2023 and was used to admit more than 936,500 people through December 2024, the New York Post reported, citing DHS data.

The Biden administration had expanded the use of the CBP One app to allow migrants to enter the U.S. at ports of entry or via a separate parole process. That process involved them uploading information including a photograph.",Juan Carlos Rodrigues Romero,shooting,FOX,https://www.foxnews.com/us/ice-officers-injured-illegal-immigrant-strikes-agents-rams-vehicles-arrest-attempt,right-leaning
"Lawyers for a man shot last week by an immigration agent in Southern California are disputing the account given by federal officials who charged him with assault.

The lawyers for Carlos Jimenez, 25, said on Monday that he was a bystander asking federal agents to move away from a bus stop where schoolchildren would soon be gathering. At the time, the immigration officers had stopped a vehicle near the bus stop in Ontario, Calif., about 40 miles east of downtown Los Angeles.

Lawyers for Mr. Jimenez, a U.S. citizen, said he was later shot in the shoulder as he drove away from federal agents, but said that he did not try to use his vehicle to harm anyone.

Federal prosecutors, however, said last week in a criminal complaint that an Immigrations and Customs Enforcement officer shot Mr. Jimenez because he pulled forward, turned his wheels and “rapidly accelerated” toward an officer during the vehicle stop on Thursday.

Tricia McLaughlin, a spokeswoman for the Department of Homeland Security, said on Monday that at about 6:30 a.m. on Thursday morning, Mr. Jimenez drove up to a team of immigration officers overseeing a vehicle stop. He then “engaged in a verbal altercation with the officers,” according to the criminal complaint filed against him, and officers ordered him to leave.

Mr. Jimenez reversed his car toward them and “an ICE officer, fearing for his life, fired defensive shots at the vehicle,” she said.

He was charged on Friday with assault of a federal officer following the incident. He was released on bond.

The altercation was the latest high-profile incident in which federal agents fired shots at drivers whom they accused of endangering them during immigration enforcement operations.

Last month, a Mexican man targeted by immigration authorities was injured by gunfire during an operation in Los Angeles. In September, during a traffic stop in Chicago, an ICE agent shot and killed a man who authorities said had hit an officer with his car. A New York Times examination of video from the scene called into question elements of the official D.H.S. account of the encounter.

Editors’ Picks

Her Grandmother Told Her ‘Maybe You’ll Marry Him One Day’

The Good List: 7 Things to Add Some Delight to Your Day

5 Books to Lift You Up During Life’s Hardest Times
Ms. McLaughlin called the most recent incident an example of  increasing threats that ICE officers face “as they risk their lives to enforce the law and arrest criminals.” She said that anyone who gets in the way of federal officers’ duties or threatens them will be arrested and prosecuted.

Mr. Jimenez’s lawyers told a very different story.

They described him, in an interview on Monday, as a father of three young children who lives in a mobile home park near where the officers were conducting their stop. He was headed to his job at a food bank, where he prepares and delivers donation boxes, when he noticed the officers blocking traffic, said Cynthia Santiago, one of his lawyers.

Mr. Jimenez pulled over to ask the officers if they could clear the street and move away from a nearby bus stop where children would soon be showing up to go to school, his lawyers said.

Federal officials and Mr. Jimenez’s lawyers agree that a federal officer approached Mr. Jimenez’s driver’s side window with a gun in hand, and then retrieved pepper spray. And they agree that Mr. Jimenez quickly reversed his vehicle.

Federal officials said that it appeared Mr. Jimenez was trying to drive toward an officer behind him to potentially cause harm. But Mr. Jimenez’s lawyers said that he was trying to get around the law enforcement vehicles so he could leave, and that officers shot him as he was driving away from them.

“He has to back up to get around the vehicles and around the police cars,” said Robert Simon, one of his lawyers. “They shoot him as he’s driving south, driving away.”

Mr. Simon shared photos of Mr. Jimenez’s car that show the bullet that struck Mr. Jimenez’s shoulder pierced the back passenger window of his car. That suggests Mr. Jimenez had already begun driving away and that the officers were behind him when one fired at him, the lawyers said.

“None of these facts line up,” Ms. Santiago said. “The aggressiveness and the violence used against our communities for people with or without status is pretty evident, and it just seems that they’re using our communities as training grounds.”

Mr. Jimenez is scheduled to return to court on Nov. 25.",Carlos Jimenez,injured,NY Times,https://www.nytimes.com/2025/11/03/us/ontario-ice-agent-shooting.html ,left-leaning
"Two shootings involving U.S. Immigration and Customs Enforcement officers took place over the past 10 days in Southern California as individuals on the left continue to track its agents.

Department of Homeland Security Assistant Secretary Tricia McLaughlin said in a statement provided to Fox News Digital that an individual pulled their car in front of ICE officers on Thursday in Ontario, California. After ICE officers ordered the driver to leave the area, the individual attempted to run them over ""by reversing directly at them without stopping,"" the DHS official said.

One ICE officer feared ""for his life"" and fired shots at the car, which McLaughlin said fled the area. DHS identified the suspect as 23-year-old Carlos Jimenez. The agency said Jimenez suffered non-life-threatening injuries in the shooting and is being detained at West Valley Detention Center. He faces pending charges of assaulting, resisting or impeding.

McLaughlin said the incident is ""another example of the threats our ICE officers are facing day-in and day-out.""

""ICE officers now face a 1,000% increase in assaults against them including cars being used as weapons and death threats against our agents are up 8,000%,"" she said. ""This violence must end. Let me be clear: Anyone who assaults, impedes, obstructs, or threatens the lives of federal officers will be arrested and prosecuted to the fullest extent of the law.""

In a separate incident on Oct. 21, DHS said TikTok influencer Carlito Ricardo Parias, an illegal immigrant, tried to ram his car into a law enforcement vehicle in Los Angeles.

ICE officers fired shots at Parias, hitting him in the elbow, McLaughlin said. One U.S. Marshals officer was also shot in the hand by a ricochet bullet.

Both individuals are in stable condition, and the DHS official said charges are being pursued against Parias for allegedly assaulting, resisting, or impeding federal law enforcement.

According to the Los Angeles Times, Parias has been tracking ICE agents for months before his eventual arrest, and was known by some people as ""Tiktokquero,"" ""El Señor Richard and ""Richard.""

Attorney General Pam Bondi called out Democrats in Los Angeles, including Mayor Karen Bass, after they released plans to track ICE agents.

""Shutdown Democrats are already refusing to pay our law enforcement agents. Now, @RepRobertGarcia and @SenBlumenthal are trying to put ICE agents at risk just for doing their jobs,"" Bondi wrote. ""@TheJusticeDept has ZERO tolerance for violence against law enforcement — we will prosecute any person who physically assaults our agents.""

Fox News Digital reached out to Bass, Rep. Garcia, D-CA, and Sen. Blumenthal, D-Conn., for comment.",Carlos Jimenez,injured,FOX,https://www.foxnews.com/us/blue-state-ice-agents-dodge-bullets-speeding-cars-left-ramps-up-tracking-campaigns,right-leaning
" Garcia-Sorto, whom DHS described as a Honduran in the U.S. illegally, was stopped by ICE officers around 4 a.m. along Interstate 17. DHS officials said Garcia-Sorto began to pull away when officers approached his car. An officer who was in the path of the vehicle “defensively discharged his service weapon” twice, officials added. The officer was taken to the hospital for evaluation; the extent of any injuries was unclear. DHS said that Garcia-Sorto was also treated at the hospital for a wound and was stable and that he was later released. It is unknown whether the interaction was captured on video.",Jose Garcia-Sorto,injured,NBC,https://www.nbcnews.com/news/us-news/ice-shootings-list-border-patrol-trump-immigration-operations-rcna254202,left-leaning
"A man from Honduras was wounded Wednesday morning after a shooting during a traffic stop involving Immigration and Customs Enforcement (ICE) near Phoenix, Arizona.

The shooting happened at 4 a.m. Wednesday after ICE officers pulled over Jose Garcia-Sorto along Interstate 17 in north Phoenix.

Garcia-Sorto, the driver, initially stopped but started to pull away as the officers walked up to his vehicle, the Department of Homeland Security (DHS) told Fox News Digital.

It is unclear why Garcia-Sorto was stopped.

""As officers approached the vehicle, Garcia-Sorto began to pull away,"" said DHS Assistant Secretary Tricia McLaughlin. ""As the vehicle abruptly began speeding away, an officer was in the path of the vehicle. Fearing for his life, the officer defensively discharged his service weapon two times striking Garcia-Sorto’s vehicle.""

The officer who fired his gun was taken to the hospital for evaluation, officials said. 

Garcia-Sorto was also taken to the hospital for treatment of a wound, and remains in stable condition.

""These are the consequences of conduct and rhetoric by dishonest politicians who spew misinformation and activists who urge illegal aliens to resist arrest,"" McLaughlin said. ""Resisting arrest puts the safety of illegal aliens, law enforcement, and the public at risk. Our law enforcement officers are facing a more than 1000% increase in assaults against them including vehicle rammings by illegal aliens. We are once again calling on sanctuary politicians, agitators, and the media to turn the temperature down and stop calling for violence and resistance against ICE law enforcement.""

McLaughlin added arrest evasions have come after sanctuary politicians allegedly held webinars, providing resources and tips for how to openly defy ICE.

The suspect's wife reportedly told a local outlet she and her husband are living in the country illegally.

Garcia-Sorto's wife, Anahi, told local outlet Arizona's Family her husband was on his way to work when the shooting occurred.

""He would get home and hug the [two] kids,"" Anahi told the outlet. ""And to see that he didn’t get here yesterday, it really hurts a lot, because I always wait for him here [at home].""

She said she heard about the shooting after family members saw it on the news and officials have not given her information about the incident.

""They (law enforcement) don’t wanna say anything to me,"" Anahi told the outlet. ""They’re only saying that he’s in the hospital, but that he’s in there with a different name, and that they don’t want him to talk, and no one can visit him.""

The FBI is investigating the shooting, according to DHS.

Anahi allegedly admitted to Arizona's Family that she and her husband are in the country illegally, but told the outlet she is praying for ICE.

""What they’re (ICE) doing is bad, but I don’t wish anything bad towards them, because I am not God to judge them,"" Anahi said. ""I pray for them.""

The outlet reported she will return to Honduras with her children if Garcia-Sorto is deported.

The northbound exit ramp at Dove Valley Road was closed during the investigation, according to the Arizona Department of Transportation. It has since reopened.",Jose Garcia-Sorto,injured,FOX,https://www.foxnews.com/us/ice-officer-shoots-illegal-immigrant-phoenix-traffic-stop-gone-wrong-both-hospitalized,right-leaning
"A U.S. Customs and Border Protection agent was arrested earlier this month after pointing a gun at a teenager during an off-duty confrontation in Temecula, according to the teen’s attorney. Gerardo Rodriguez, 45, of Temecula, faces charges that include assault with a deadly weapon, child endangerment and assault by a public officer in connection with the incident. According to attorney Greg Kirakosian, Rodriguez pointed a firearm at his teenage client. “My client, 17-year-old Mexican-American, was just dropping somebody off there,” Kirakosian said. Surveillance video captured the confrontation, which happened shortly after 10 p.m. on Nov. 10 in Temecula. At the time, the teen, who is a U.S. citizen, was driving along Daybrook Terrace, taking a friend home when he was confronted by Rodriguez. “Get out of the car. Put it in park,” Rodriguez can be heard ordering the teen in the video. After hearing of the commotion, the boy’s mother arrived at the scene with her son’s passport to prove his citizenship. The boy’s father called the Riverside County Sheriff’s Department, who arrived shortly after. In a statement, the department said that “the subject who stopped him displayed a badge and ordered the juvenile out of the vehicle at gunpoint. The juvenile complied and was ultimately released to his parents, who reported the incident to law enforcement.” The sheriff’s department confirmed deputies arrested Rodriguez without incident. A search warrant was served at his home and evidence related to the case was collected. According to the Riverside County Sheriff’s Department, Rodriguez posted bail the same day he was arrested. He’s scheduled to appear in court on Dec. 26. NBCLA is attempting to contact an attorney for Rodriguez. NBC4 has reached out to U.S. Customs and Border Protection for comment, but has not heard back. Anyone with information on the case is asked to contact Investigator Alyssa Morris at the Southwest Sheriff’s Station at 951-696-3000.","Gerardo Rodriguez, LA",brandishing,NBC,https://www.nbclosangeles.com/news/local/off-duty-federal-agent-arrest-temecula/3805911/,left-leaning
"A law enforcement officer, Gerardo Rodriguez, who neighbors in Temecula know as an agent for ICE or the Border Patrol, was arrested on Nov. 11 after pulling a firearm on a 17-year-old. The teenager had just dropped off a friend at a nearby house and was driving through the neighborhood when he was stopped by Rodriguez. Rodriguez detained the teenager for nearly 20 minutes, according to surveillance camera footage. An off-duty law enforcement officer was arrested in Riverside County last week after pulling a firearm on a 17-year-old and detaining him on the side of the road. Gerardo Rodriguez, 46, was known by neighbors to be an agent employed by U.S. Immigration and Customs Enforcement or Customs and Border Patrol, said Greg Kirakosian, a lawyer representing the teenager. An ICE spokesperson wrote that Rodriguez is not employed by the agency. A CBP spokesperson said in a statement: “This matter is under investigation.” The teenager had driven by Rodriguez’s home in Temecula to drop friends off at a nearby house at around 10 p.m. on Nov. 10, Kirakosian said. When he drove back he was stopped by Rodriguez, who pulled a gun. The Riverside County Sheriff’s Department was dispatched at around 10:40 p.m., according to a news release. Rodriguez was taken into custody without incident the next day and charged with assault by a public officer, child endangerment and assault with a deadly weapon, the Sheriff’s Department said. He posted bail the same day and his next court date is scheduled for Dec. 26. The teenager and his family, who are all U.S. citizens,,“were already scared to begin with” before the incident, Kirakosian said. “They’re Mexican Americans, you know, in Southern California right now, and there’s ICE raids happening left and right,” he said. Security camera footage from a neighbor shows Rodriguez “in the middle of the street, kind of marching down with a gun in his hand,” Kirakosian said. “It’s not like he pulled it out in an emergency. He had it out. He was walking down the street with a gun in his hand,” he said. As he sees the truck approach, Rodriguez walks toward the middle of the street, pulls out a gun and points it at the vehicle. “Stop, stop. Slow down. Freeze. Police,” Rodriguez yells. The teenager feared he would be shot, Kirakosian said, so he stopped. Rodriguez ordered him to park, again identifying himself as police, then approached the driver’s side and pointed his gun at the teenager. Rodriguez interrogated him, asking where he and his family were from and demanded identification, Kirakosian said, for nearly 20 minutes. In the video, Rodriguez argues with the teenager, claiming he was speeding down the street. He repeatedly claims the teenager almost ran him over. The teenager’s friends, who were still at a house nearby, saw the incident and notified parents who were also at the home and approached Rodriguez, eventually persuading him to let the teenager go, according to Kirakosian. They called the teenager’s mother, who immediately grabbed her son’s passport to prove his citizenship, he said. By the time the mother had arrived, Rodriguez had left, and they then called the police. Police obtained a search warrant and confiscated Rodriguez’s security camera footage and the gun when they arrested him, Kirakosian said. The incident is the latest in a growing number of armed confrontations involving ICE agents or people posing as them confronting people and demanding identification. An ICE agent was confronted by police when he pulled a gun on a woman in Santa Ana this month, and multiple ICE and Border Patrol shootings have taken place in and outside Southern California in recent months. Kirakosian said this incident likely resulted in an arrest because the agent was off duty. “You got ICE agents who apparently feel so emboldened by what they do on a day-to-day basis, they’re essentially treating their own neighborhoods as an area they need to start investigating,” Kirakosian said.","Gerardo Rodriguez, LA",brandishing,LA Times,https://www.latimes.com/california/story/2025-11-17/riverside-county-off-duty-officer-points-gun-at-teen,right-leaning
"ICE agents detained four people from a Burnsville home, according to family members, including a 7-year-old's parents and the husband of a pregnant woman. BURNSVILLE, Minnesota — On Saturday, U.S. Immigration and Customs Enforcement agents raided a home in Burnsville and detained four people, according to family members at the house. Ring camera footage shows more than a dozen agents at the front door of the home on McAndrews Road. 'They just kept banging on the door until they broke it down,' said Sofia Alvarado, through an interpreter. Alvarado's husband owns the home and they rent the lower level.  Damage could be seen not only on the front door but also on multiple doors throughout the home on both levels. Alvarado heard banging and she, along with three other family members on the upper floor, hid in the bathroom, not knowing who was at the door. Angel, Sofia's brother, said ICE agents took his sister, mom, daughter and niece into the kitchen and made them hand over their phones. 'They all were scared, crying... they were pointing with the guns not to move,' Angel said.  About a dozen ICE agents were captured on a Ring camera before raiding a Burnsville home. He said all four are U.S. citizens and were able to show their paperwork to ICE eventually. Sofia said it all started when the couple renting on the lower level was headed home from the grocery store. According to Sofia, the couple was followed home by ICE agents. Ring camera footage shows ICE agents detaining the man while the woman runs away. Family said she ran into the house and hid with her 7-year-old boy.  On Sunday, a large hole could be seen through the bedroom door. Sofia and other family members at the house said ICE agents detained both of the 7-year-olds' parents and that his father has a work permit. A hole can be seen in the downstairs bedroom after ICE agents raided the home on Saturday. Sofia says ICE also detained another man downstairs and a fourth man, a father to two kids with a third child on the way. His wife, who asked to remain anonymous for safety reasons, is six months pregnant. 'She said as soon as her husband walked out of the room, she didn't see him again,' an interpreter told KARE 11. She hid with her 7-year-old daughter and 1-and-a-half-year-old boy.  'When she went out, they were pointing their guns at her,' an interpreter said.  She said the family is here illegally from Honduras for work and that ICE told her to voluntarily self-deport. An interpreter said, 'She said that if you can have someone help her... have her husband come back home because in the state that she is in with two kids and one more on the way, she thinks it's going to be very hard for her.' She is also now taking care of the 7-year-old boy while they wait to find out what will happen to his parents. The families at the house claimed ICE entered the home without showing a warrant. On Wednesday, the Department of Homeland Security told KARE 11 that they had obtained a warrant of removal before entering the home. 'If they're going to enter an actual home or a premises to arrest somebody, I don't believe that just a removal order alone would overcome somebody's fourth amendment rights,' said Michael Davis, managing partner at Davis Immigration Lawyers, PLLC in Minneapolis. 'There is some debate about an administrative warrant versus a judicial warrant, and the usual rule is that they would have to have a judicial warrant to enter. Just a pure administrative warrant would not be sufficient.' Department of Homeland Security Assistant Secretary Tricia McLaughlin responded to KARE 11's request for comment on Wednesday and said, 'On Dec. 6, 2025, ICE law enforcement officers conducted a targeted enforcement operation to arrest illegal aliens released into the country by the Biden administration.' DHS said when officers attempted a vehicle stop, the couple ignored law enforcement's commands. As the woman fled, officers were able to arrest the man. DHS claims he 'kicked and assaulted law enforcement.' Ring camera footage shows the initial encounter. An agent can be seen running towards the man after he exits the vehicle. They immediately clash, with the man falling to the ground. Two agents then can be seen on top of him.  McLaughlin added that 'the U.S. citizens in the house were never arrested. They were briefly questioned.' DHS identified the four people detained as Rosibel Rivera Amaya, Jose Otero Rodriguez, Geyser Ramirez Mejia and Jose Mateo Romero.  The city of Burnsville put out a statement on Sunday saying that they are 'actively monitoring federal immigration activity' and that 'Burnsville Police do not engage in federal immigration enforcement and are typically not notified of federal operations.'","Burnsville, MN",brandishing,NBC,https://www.wcnc.com/article/news/politics/immigration-news/ring-camera-captures-burnsville-ice-raid-that-leaves-7-year-old-without-parents-according-to-family-mn/89-1a69f800-3a3a-480d-9d9c-e09715d2ed04,left-leaning
