text,event,severity,outlet,url,bias
"US Customs and Border Protection officers opened fire during a targeted immigration enforcement operation in San Bernadino, California, on Saturday, calling it an act of self-defense after a man “struck two CBP officers with his vehicle,” the Department of Homeland Security said. But the family inside the vehicle said they drove away out of fear for their safety after masked men emerged from unmarked cars and surrounded their truck with weapons drawn before smashing the truck’s windows. Martin, one of the three men in the vehicle, told CNN affiliate KABC he was working with his father-in-law and 18-year-old brother-in-law on Saturday morning when their vehicle was suddenly surrounded. The agents did not identify themselves and the family stayed inside the locked car, said Martin, who KABC only identified by his first name. Videos recorded from inside the family’s truck show at least three masked agents wearing tactical vests marked with “police” surrounding the car. At least one of the agents is wearing a hat marked “CBP.” The agents are seen asking the men inside the truck to roll down the window, but the men refuse. The agents are then seen breaking two windows in the truck before the driver accelerates away. It’s unclear why DHS was pursuing the men in the vehicle. “Once the glasses were shattered, my father-in-law, fearing for his life from his perspective … he drove the vehicle away from where those agents were at,” Martin told KABC. It is unclear in the videos when officers were struck by the vehicle. In its statement, DHS said two officers were injured. It did not specify the severity of the injuries. As the truck drives away, three apparent gunshots can be heard in the videos and one video shows what seems to be bullet holes in the side of the truck. “Thank God the bullets didn’t go through the truck. They just went in, got stuck into the door, but they were aimed at my brother-in-law, who was in the passenger front,” Martin told KABC. Once home, the men called San Bernardino police to report the incident, Martin said. At 9:30 a.m., about an hour after the vehicle stop, armed immigration and Homeland Security agents, along with San Bernardino police, surrounded the family’s home, according to the Inland Coalition for Immigrant Justice. They remained at the scene until 3:45 p.m., despite never presenting a warrant, “pressuring the individual to come outside and placing the entire family in fear,” the organization said in a statement to CNN. “This is a clear abuse of power. Firing at civilians, detaining families without cause, and silencing community voices is unacceptable and must end,” the organization said. DHS said local police “located the subject at a residence and briefly had him in custody,” but “he was set free” and officers left the scene. “This decision was made despite the subject refusing to comply and wounding two officers — another terrible example of California’s pro-sanctuary policies in action that shield criminals instead of protecting communities,” DHS said in a statement. According to KABC, San Bernardino police cited the California Values Act, which prevents local law enforcement from helping federal officials with immigration enforcement actions. Police told KABC they later returned to the scene after a request from federal officials due to a large crowd forming as federal officers attempted to arrest a man. The department said it learned the man, whose identity was not revealed, was wanted for assaulting a federal officer. It’s unclear if the man was taken into custody. CNN has reached out to the San Bernardino County Sheriff’s Department and San Bernardino Police Department for further information.",San Bernardino,shooting,CNN,https://www.cnn.com/2025/08/18/us/federal-agents-open-fire-san-bernardino-enforcement-hnk,left-leaning
"A man who was shot at by federal agents during a standoff with U.S. Customs and Border Protection agents in Southern California earlier in the month has been detained, his family tells FOX 11. What we know: Back on August 16, Francisco Longoria and multiple passengers were inside a work truck in San Bernardino when a group of masked men tried to get them to get out of the vehicle. At one point during the standoff between Longoria, the truck passengers, and the masked men who were later revealed to be CBP agents, one of the federal agents began smashing the work truck. The sudden attack prompted the driver of the truck to drive off from the scene. As the work truck took off from the scene, one of the CBP agents opened fire at Longoria and the passengers, prompting an ICE-involved shooting investigation. Videos showing parts of the incident went viral on social media. An organization called Inland Coalition for Immigrant Justice shared a post showing a driver and at least two passengers refusing to get out of a car and a CBP agent smashing the car's window, prompting the driver to take off from the scene. Fast-forward to more than a week later, Longoria's family revealed that Francisco has since been taken into custody. According to his attorney, Homeland Security Investigations arrested Longoria at his home around 4:18 a.m. Thursday, Aug. 28.  Longoria was arrested on a single charge of alleged Assault of a Federal Officer with a Deadly/Dangerous Weapon. He was arraigned later in the afternoon. His attorney said no arrest warrant was issued at the time of the August 16 incident and the government claimed ICE and CBP agents decided to perform an ""immigration check"" on Longoria. The criminal complaint alleged that the agents involved in the stop had been injured by Longoria's truck. The court asked AUSA Cory Burleson to identify any injuries allegedly sustained by the agents. Burleson then acknowledged ""I’m not aware of any injuries"", according to a statement issued by Longoria's attorney. ",San Bernardino,shooting,FOX,https://www.foxla.com/news/man-shot-ice-agent-during-california-standoff-custody-family-says,right-leaning
"An immigration enforcement raid at a farm in Camarillo turned into a violent clash between U.S. Border Patrol agents and protesters Thursday afternoon. Tensions escalated at a Glass House Farms near Laguna Road after border patrol agents were in the process of 'executing a warrant at a marijuana facility,' according to a statement from the U.S. Department of Homeland Security provided to CBS News. Federal agents said they were also executing a criminal warrant at another farm in Carpinteria around the same time. DHS said that about 200 people were detained at both sites. Agents formed a line to prevent a crowd of protesters from getting to the other side of the roadway. Video from a CBS News Los Angeles photographer at the scene showed agents telling the crowd to move back and disperse before they began deploying what appeared to be less-than-lethal rounds and tear gas canisters. The SkyCal chopper flew over the scene where people could be seen running as smoke filled the area. Protesters stayed in the area for several hours, turning into an hours-long standoff before a convoy of federal agents circumvented the protesters using dirt roads near the farm. A group noticed the convoy and attempted to intercept them by trying to stop the van from leaving and throwing rocks, shattering windows and windshields. Crowds finally cleared into the overnight hours. 'There's a real cost to these inhumane immigration actions on hardworking families and communities, including farmworker communities, across America,' Gov. Gavin Newsom said in a statement. 'Instead of supporting the businesses and workers that drive our economy and way of life, Stephen Miller's tactics evoke chaos, fear and terror within our communities at every turn,' referring to President Trump's Deputy Chief of Staff. U.S. Attorney Bill Essayli wrote in a post on X that a protester at the incident in Camarillo allegedly 'appeared to fire a pistol at federal law enforcement.' 'FBI has issued a $50,000 award for information leading to the conviction of an Unknown Subject who appeared to fire a pistol at Federal Law Enforcement Officers near Camarillo,' Essayli wrote. 'The shooting occurred on 7/10/25 at approximately 2:26pm on Laguna Rd between Wood Rd and Las Posas Rd.' In its statement, the Department of Homeland Security said it is conducting an ongoing investigation into immigration and potential child labor violations at the farms in Camarillo and Carpinteria. ",Camarillo Farm,lesslethal,CBS,https://www.cbsnews.com/losangeles/news/camarillo-farm-raid-immigration-glass-house-farms/,left-leaning
"Protesters clashed with federal authorities Thursday during an immigration operation north of Los Angeles at a marijuana farm allegedly employing illegal immigrants. Multiple agents arrived at the Glass House Farms, a state-licensed cannabis facility which is considered illegal under federal law, in Camarillo. Federal authorities had a warrant for illegal employees, Fox News has learned. Another raid also occurred at another Glass House Farm in Carpinteria. In addition, U.S. Attorney for the Central District of California Bill Essayli said the FBI has offered a $50,000 award for information leading to the conviction of an unknown suspect who appeared to fire a pistol at federal law enforcement officers near Camarillo. Protesters clashed with federal authorities Thursday during an immigration operation north of Los Angeles at a marijuana farm allegedly employing illegal immigrants. Multiple agents arrived at the Glass House Farms, a state-licensed cannabis facility which is considered illegal under federal law, in Camarillo. Federal authorities had a warrant for illegal employees, Fox News has learned. Another raid also occurred at another Glass House Farm in Carpinteria. In addition, U.S. Attorney for the Central District of California Bill Essayli said the FBI has offered a $50,000 award for information leading to the conviction of an unknown suspect who appeared to fire a pistol at federal law enforcement officers near Camarillo. At the cannabis facility, investigators found nine unaccompanied migrant children, Department of Homeland Security spokeswoman Tricia McLaughlin told Fox News Digital on Friday, updating earlier reporting that eight such children were there. She added, ""So glad our law enforcement could rescue another child."" Customs and Border Protection Commissioner Rodney Scott said Thursday the facility was ""under investigation for child labor violations.""He posted a photo to X on Friday afternoon captioned: ""These are the juveniles found in the marijuana facility - almost all unaccompanied, one as young as 14. California are you ready to partner with us to stop child exploitation?"" People were seen confronting the agents, who used tear gas and smoke bombs. Federal personnel used gas to push back protesters who arrived on scene after getting word of a raid. Military helicopters were also seen flying low over the fields, a maneuver generally used to flush out people hiding. ""It is becoming increasingly apparent that the actions taken by ICE are bold and aggressive, demonstrating insensitivity towards the direct impact on our community,"" Luis Mc Arthur, the mayor of nearby Oxnard, said in a social media post. ""These actions are causing unnecessary distress and harm. I remain committed to working alongside our Attorney General and the Governor’s office to explore potential legal avenues to address these activities."" Footage captured by the news outlet showed several people being detained. ""FBI has issued a $50,000 award for information leading to the conviction of an Unknown Subject who appeared to fire a pistol at Federal Law Enforcement Officers near Camarillo,"" Essayli wrote on X. Four people were transported to the hospital, the Ventura County Fire Department said. Three additional people were treated at the scene without being transported, Fox Los Angeles reported. U.S. Rep. Salud Carbajal, D-Calif., said he went to the scene of the raid in Capenteria, saying 50 ICE agents arrived at the farm. ""This is deplorable. This should not be happening on our soil,"" he said in a video message. ""Individuals dressed like military personnel on our soil. We don't do that in America."" ""This was overkill. This was ridiculous. This was a bunch of crap,"" he added. Thursday's raid is one of many that have happened in Southern California, much to the anger of local and state Democratic officials. Earlier this week, immigration authorities were in MacArthur Park in Los Angeles conducting a raid. Los Angeles Mayor Karen Bass and California Gov. Gavin Newsom condemned the operation and the Trump administration for targeting illegal immigrants for deportation. Newsom criticized Thursday's raid and President Donald Trump on X. ""Kids running from tear gas, crying on the phone because their mother was just taken from the fields,"" the governor wrote in a post accompanied by a video showing people running to avoid tear gas deployed by authorities. ""Trump calls me 'Newscum' — but he’s the real scum."" In another post, Newsom said White House Deputy Chief of Staff Stephen Miller, the architect of the administration's tough stance on illegal immigration, was running the White House. ""Instead of supporting the businesses and workers that drive our economy and way of life, Stephen Miller’s tactics evoke chaos, fear and terror within our communities at every turn,"" he wrote. ""At Miller’s direction, Trump’s agents continue to detain U.S. citizens and racially profile Americans, ripping families apart and disappearing parents and workers into cruel federal detention centers to meet their self-imposed arrest quotas."" Bass has demanded the federal government end such operations in the city. ",Camarillo Farm,lesslethal,FOX,https://www.foxnews.com/us/immigration-operation-california-cannabis-farms-leads-clash-federal-agents-protesters,right-leaning
"Forest Park Mayor Rory Hoskins and other officials are demanding accountability after he said U.S. Immigration and Customs Enforcement agents detained U.S. citizens using excessive force at Concordia Cemetery last week. This comes after they said four U.S. citizens were wrongfully detained and assaulted by ICE last week as part of 'Operation Midway Blitz.' The encounter was at Concordia Cemetery. The Department of Homeland Security said agents were attempting to arrest two undocumented immigrants when the pair crossed into the Des Plaines River, trying to escape. Hoskins said ICE broke the gate to get into the private property and arrested four employees in the process. Those employees were U.S. citizens, according to Hoskins. He said the agents used unnecessary physical force, including the use of pepper balls, before detaining them for several hours. 'Their constitutional rights have been violated,' he said. 'Forest Park is one of many communities right now dealing with ICE and customs officials who are treating members of the community as if they're less than.' DHS told CBS News Chicago the four employees were trying to impede their arrest of the two undocumented immigrants.",Forest Park,lesslethal,CBS,https://www.cbsnews.com/chicago/news/forest-park-ice-agents-excessive-force-concordia-cemetery/ ,left-leaning
"FOREST PARK, Ill. - The mayor of Forest Park says there is a surge of ICE activity in the village. He wants his west suburban community to know that ICE agents assaulted and detained American citizens on private property last week. What we know: Forest Park Mayor Rory E. Hoskins provided cell phone video showing federal agents demanding to be let into Concordia Cemetery, and the vapor of chemicals deployed on four cemetery workers. One of the workers told Fox 32 they heard a man in distress in the Des Plaines River on October 7. When they looked into it, federal agents demanded access to the locked cemetery. The agents were told it was private property. The agents cut the lock on the gate and, according to the workers, deployed pepper spray, body slammed, and cuffed them for five hours. 'What happened to me and my co-workers was alarming and it reminded me of how important it is we all uphold the constitution,"" said Darren Eichler, one of the workers. Hoskins met with the men about their experience. ""It’s an indication of poor training or just bad intentions on the part of ICE,"" the mayor said. What they're saying: The Department of Homeland Security said in a statement that agents were trying to rescue the two men from the nearby Des Plaines River. DHS Assistant Secretary Tricia McLaughlin said in the statement: ""Despite the agitation and lack of help from local government, ICE successfully arrested both illegal aliens, including Martin Martinez Guereca, a criminal illegal alien from Mexico, previously convicted of assault in 2004, and Jaime Arturo Martinez Rojas, a criminal illegal alien from Mexico with previous arrests for drug possession and driving under the influence. The four U.S. citizens who obstructed law enforcement from the rescue operation were arrested."" Also on Monday, DHS said in a post on X that its so-called Operation Midway Blitz has resulted in the arrests of more than 1,500 people in the Chicago area. The four workers are still unsure of the allegations. ""These are not public figures,"" Hoskins said. ""These are private men who work in a cemetery. They suffered a very traumatic incident, detained for hours at a time, maced, dehumanized, taunted and here they are back in our community, and we want to make sure they feel protected."" Three workers were released from a facility in Lombard. The hospitalized worker was treated and released from an area hospital. They are considering legal action.",Forest Park,lesslethal,FOX,https://www.fox32chicago.com/news/forest-park-ice-arrests,right-leaning
"LOS ANGELES — Federal officers and National Guard troops fanned out around a mostly empty Los Angeles park in a largely immigrant neighborhood on foot, horseback and military vehicles on Monday for about an hour before abruptly leaving, an operation that local officials said seemed designed to sow fear. The Department of Homeland Security wouldn't say whether anyone had been arrested during the brief operation at MacArthur Park. Federal officials did not respond to requests for comment about why the park was targeted or why the raid ended abruptly. About 90 members of the California National Guard were present to protect immigration officers, defense officials said. 'What I saw in the park today looked like a city under siege, under armed occupation,' said Mayor Karen Bass, who showed up at the park alongside activists. She said there were children attending a day camp in the park who were quickly ushered inside to avoid seeing the troops. Still, Bass said an 8-year-old boy told her that 'he was fearful of ICE.' Federal officers descend on MacArthur Park. The operation occurred at a park in a neighborhood with large Mexican, Central American and other immigrant populations and is lined by businesses with signs in Spanish and other languages that has been dubbed by local officials as the 'Ellis Island of the West Coast.' Sprawling MacArthur Park has a murky lake ringed by palm trees, an amphitheater that hosts summer concerts and sports fields where immigrant families line up to play soccer in the evenings and on weekends. A thoroughfare on the east side is often crammed with food stands selling tacos and other delicacies, along with vendors speaking multiple languages and hawking T-shirts, toys, knickknacks and household items. Among those who spoke with Bass were health care outreach workers who were working with homeless residents Monday when troops pointed guns at them and told them to get out of the park. Photos show federal officers riding on horseback toward a mostly empty soccer field. Other heavily armed authorities stood guard around the area alongside armored vehicles. 'The world needs to see the troop formation on horses walking through the park, in search of what? In search of what? They're walking through the area where the children play,' Bass said. Eunisses Hernandez, a council member whose district includes MacArthur Park said 'it was chosen as this administration's latest target precisely because of who lives there and what it represents.' Operation escalates Trump's immigration crackdown The operation in the large park about 2 miles west of downtown LA included 17 Humvees, four tactical vehicles, two ambulances and the armed soldiers, defense officials said. It came after President Donald Trump deployed thousands of Guard members and active duty Marines to the city last month following protests over previous immigration raids. Trump has stepped up efforts to realize his campaign pledge of deporting millions of immigrants in the United States illegally and shown a willingness to use the nation's military might in ways other U.S. presidents have typically avoided. In response to questions about the operation in MacArthur Park, the Department of Homeland Security said in an email that the agency would not comment on 'ongoing enforcement operations.' More than 4,000 California National Guard and hundreds of U.S. Marines have been deployed in Los Angeles since June — against the wishes of California Gov. Gavin Newsom. Last week, the military announced about 200 of those troops would be returned to their units to fight wildfires. Newsom called the events at the park 'a spectacle.' Two defense officials told reporters that what happened at MacArthur Park on Monday was not a military operation but acknowledged that the size and scope of the Guard's participation could make it look like one to the public. That is why the officials spoke on condition of anonymity to provide details about the raid that were not announced publicly. The primary role of the service members would be to protect the immigration enforcement officers in case a hostile crowd gathered, one of the officials said. 'It's just going to be more overt and larger than we usually participate in,' that official said. Local officials say feds are sowing fear 'This morning looked like a staging for a TikTok video,' said Marqueece Harris-Dawson, president of the Los Angeles City Council, adding if Border Patrol wants to film in LA, 'you should apply for a film permit like everybody else. And stop trying to scare the bejesus out of everybody who lives in this great city and disrupt our economy every day.' Chris Newman, legal director for the National Day Laborer Organizing Network, said he received a credible tip about the operation Monday. 'It was a demonstration of escalation,' Newman said. 'This was a reality TV spectacle much more so than an actual enforcement operation.' Since federal agents have been making arrests at Home Depot parking lots and elsewhere in Los Angeles, Newman said fewer people have been going to the park and immigrant neighborhoods near the city's downtown. Betsy Bolte, who lives nearby, came to the park after seeing a military-style helicopter circling overhead. She said it was 'gut-wrenching' to witness what appeared to be a federal show of force on the streets of a U.S. city. 'It's terror and, you know, it's ripping the heart and soul out of Los Angeles,' she said. 'I am still in shock, disbelief, and so angry and terrified and heartbroken.'",MacArthur Park,brandishing,NBC,https://www.nbcnews.com/news/us-news/troops-federal-agents-briefly-descend-ls-macarthur-park-largely-immigr-rcna217405,left-leaning
